{
  "schema_version": 1,
  "repository": "phuongphh/FinanceAssistant",
  "task_id": "FA-example-1",
  "kind": "coding",
  "issue_number": 1,
  "base_sha": "aaaaaaaaaaaaaaaaaaaaaaaaaaaaaaaaaaaaaaaa",
  "base_branch": "main",
  "branch": "agent/issue-1-example",
  "engine": "codex",
  "goal": "Example task, not admitted",
  "scope": {
    "allowed_paths": [
      "example/**"
    ],
    "excluded_paths": [
      ".github/**",
      "scripts/agent_loop/**",
      "scripts/delivery/**",
      "docs/contracts/**",
      ".env*"
    ],
    "out_of_scope": [
      "Deployment"
    ]
  },
  "acceptance_criteria": [
    {
      "id": "AC1",
      "criterion": "Expected observable behavior",
      "verification": "Run isolated test"
    }
  ],
  "dependencies": [],
  "approval": {
    "reference": "https://github.com/example/product/issues/1",
    "scope_id": "approved-batch-example",
    "actor": "example-owner",
    "approved_at": "2026-10-25T00:00:00Z"
  },
  "limits": {
    "max_minutes": 90,
    "max_fix_rounds": 2,
    "max_cost_usd": 5,
    "daily_budget_reference": "example-policy-not-approved-budget"
  },
  "target_environment": "dev-macmini",
  "receipt_location": "controller://example/task/FA-example-1"
}
